{
  "$schema": "../grade.schema.json",
  "id": "g3",
  "key": "G3",
  "label": "3rd Grade",
  "shortLabel": "3rd",
  "ordinal": 3,
  "description": "Third grade mathematics topics",
  "default": true,
  "enabled": true,
  "standards": {
    "Operations & Algebraic Thinking": [
      "3.OA.A.1",
      "3.OA.A.2",
      "3.OA.A.3",
      "3.OA.B.4",
      "3.OA.B.5",
      "3.OA.B.6",
      "3.OA.C.7",
      "3.OA.D.8"
    ],
    "Number & Operations—Fractions": ["3.NF.A.1", "3.NF.A.2", "3.NF.A.3"],
    "Measurement & Data": [
      "3.MD.A.1",
      "3.MD.A.2",
      "3.MD.B.3",
      "3.MD.B.4",
      "3.MD.C.5",
      "3.MD.C.6",
      "3.MD.C.7",
      "3.MD.D.8"
    ],
    "Geometry": ["3.G.A.1", "3.G.A.2"]
  }
}
